{
  "$schema": "https://json-schema.org/draft/2020-12/schema",
  "$id": "urn:miner-status-ios:schema:miner-status:1",
  "title": "Miner status feed (whitelist)",
  "description": "Whitelist-only status feed read by the iPhone app. Every key is required; absent data is an explicit null (shown as 無資料), undeterminable state is the string \"unknown\" (shown as 未知). Never pass through raw source state: no token, PID, log path, wallet, account, full command line or exception text. Receive time and monotonic time are recorded by the client and are NOT part of this payload.",
  "type": "object",
  "additionalProperties": false,
  "required": ["schemaVersion", "dataOrigin", "demoNotice", "publishedAt", "machines"],
  "properties": {
    "schemaVersion": {
      "const": 1
    },
    "dataOrigin": {
      "description": "\"demo\" marks hand-written mock data. The app must show a visible demo banner and must never present it as a live connection.",
      "enum": ["demo", "live"]
    },
    "demoNotice": {
      "description": "Required non-empty text when dataOrigin is demo; null when live.",
      "type": ["string", "null"]
    },
    "publishedAt": {
      "description": "When the publisher wrote/served this document. Rewriting a cache file updates this but must NOT make any observedAt newer.",
      "$ref": "#/$defs/timestampOrNull"
    },
    "machines": {
      "type": "array",
      "items": { "$ref": "#/$defs/machine" }
    },
    "market": {
      "description": "OPTIONAL extension, the only keys that may be absent: sent only to clients that ask for earnings (header X-Miner-Status-Features: earnings), so older apps keep receiving the base whitelist. Null when prices are unavailable.",
      "oneOf": [{ "type": "null" }, { "$ref": "#/$defs/market" }]
    },
    "tariff": {
      "description": "OPTIONAL extension sent with market: the published Taipower simple two-stage time-of-use rates and upcoming weekday days off (billed off-peak all day). Null when never fetched.",
      "oneOf": [{ "type": "null" }, { "$ref": "#/$defs/tariff" }]
    },
    "advice": {
      "description": "OPTIONAL extension (feature `advice`): for machines whose electricity is billed, whether mining is currently worth it, including machines that are switched off and so absent from machines. Null when the publisher has no advisor.",
      "oneOf": [{ "type": "null" }, { "type": "array", "maxItems": 8, "items": { "$ref": "#/$defs/advice" } }]
    },
    "cumulative": {
      "description": "OPTIONAL extension (feature `cumulative`): each machine's estimated earnings added up since `since`, for checking against the pool account at the end of the month. An estimate, not money received. Null before anything has been added up.",
      "oneOf": [{ "type": "null" }, { "$ref": "#/$defs/cumulative" }]
    }
  },
  "allOf": [
    {
      "if": { "properties": { "dataOrigin": { "const": "demo" } } },
      "then": { "properties": { "demoNotice": { "type": "string", "minLength": 1 } } },
      "else": { "properties": { "demoNotice": { "type": "null" } } }
    }
  ],
  "$defs": {
    "timestamp": {
      "description": "RFC 3339 date-time with explicit offset (Z or ±hh:mm). Local times without date/offset (e.g. log HH:MM:SS) must be null until calibrated.",
      "type": "string",
      "format": "date-time",
      "pattern": "^\\d{4}-\\d{2}-\\d{2}T\\d{2}:\\d{2}:\\d{2}(\\.\\d{1,9})?(Z|[+-]\\d{2}:\\d{2})$"
    },
    "timestampOrNull": {
      "anyOf": [
        { "$ref": "#/$defs/timestamp" },
        { "type": "null" }
      ]
    },
    "nonNegativeIntOrNull": {
      "type": ["integer", "null"],
      "minimum": 0
    },
    "machine": {
      "type": "object",
      "additionalProperties": false,
      "required": [
        "machineId",
        "displayName",
        "worker",
        "sourceStatus",
        "sourceCheckedAt",
        "sessionId",
        "sampleSequence",
        "observedAt",
        "expectedRunning",
        "minerRunning",
        "hashrate",
        "gpus",
        "shares",
        "stop"
      ],
      "properties": {
        "machineId": {
          "description": "Stable key. Sources are never merged across machineIds (thresholds, scripts, hashrate differ per machine).",
          "type": "string",
          "minLength": 1,
          "pattern": "^[A-Za-z0-9._-]+$"
        },
        "displayName": {
          "type": "string",
          "minLength": 1
        },
        "worker": {
          "description": "null when the source has no confirmed worker field. Never guessed from wallet data.",
          "type": ["string", "null"]
        },
        "sourceStatus": {
          "description": "Publisher's last attempt to read this machine. Anything other than ok means the sample fields below are historical at best.",
          "enum": ["ok", "unreachable", "error", "noDataYet"]
        },
        "sourceCheckedAt": {
          "description": "When the publisher last attempted to read the source (success or failure).",
          "$ref": "#/$defs/timestampOrNull"
        },
        "sessionId": {
          "description": "Opaque id of one mining run/job. Counters, stop results and sequences are only comparable within the same sessionId; a change means rebuild the baseline.",
          "type": ["string", "null"],
          "minLength": 1,
          "maxLength": 128
        },
        "sampleSequence": {
          "description": "Strictly increasing per sessionId at the source. Same or lower value within the same session = replay/stale, not new evidence.",
          "$ref": "#/$defs/nonNegativeIntOrNull"
        },
        "observedAt": {
          "description": "Data time: when the source observed this sample (source clock). Not trusted as absolute; the client bounds it with its own receive time.",
          "$ref": "#/$defs/timestampOrNull"
        },
        "expectedRunning": {
          "description": "Persisted operator intent, not an observation. null when no reliable intent source; never inferred from minerRunning.",
          "enum": [true, false, "unknown", null]
        },
        "minerRunning": {
          "type": "object",
          "additionalProperties": false,
          "required": ["state", "observedAt"],
          "properties": {
            "state": {
              "description": "Observed miner child process state. A live guard/source script alone does not make this running.",
              "enum": ["running", "stopped", "unknown", null]
            },
            "observedAt": { "$ref": "#/$defs/timestampOrNull" }
          }
        },
        "hashrate": {
          "description": "Reported rate may be reused from an old log line; its own observedAt decides freshness. hashrate > 0 alone never means green.",
          "type": "object",
          "additionalProperties": false,
          "required": ["value", "unit", "observedAt"],
          "properties": {
            "value": {
              "type": ["number", "null"],
              "minimum": 0
            },
            "unit": {
              "enum": ["H/s", "kH/s", "MH/s", "GH/s", "TH/s", null]
            },
            "observedAt": { "$ref": "#/$defs/timestampOrNull" }
          }
        },
        "gpus": {
          "description": "null when no GPU data; [] is not used to mean missing.",
          "type": ["array", "null"],
          "items": { "$ref": "#/$defs/gpu" }
        },
        "shares": {
          "type": "object",
          "additionalProperties": false,
          "required": ["accepted", "stale", "rejected", "observedAt", "lastAcceptedAt"],
          "properties": {
            "accepted": {
              "description": "Cumulative within sessionId. Only an increase within the same session is new share evidence.",
              "$ref": "#/$defs/nonNegativeIntOrNull"
            },
            "stale": {
              "description": "null when not recorded; never defaulted to 0.",
              "$ref": "#/$defs/nonNegativeIntOrNull"
            },
            "rejected": {
              "description": "null when not recorded; never defaulted to 0.",
              "$ref": "#/$defs/nonNegativeIntOrNull"
            },
            "observedAt": { "$ref": "#/$defs/timestampOrNull" },
            "lastAcceptedAt": {
              "description": "Source time of the most recent accepted share in this session. null until date/timezone calibrated (log HH:MM:SS or process-monotonic values are not acceptable).",
              "$ref": "#/$defs/timestampOrNull"
            }
          }
        },
        "stop": {
          "description": "Stop result. Applies only when stop.sessionId equals the machine sessionId; an older run's result is never shown as the current reason. Staleness/disconnect is NOT a stop reason.",
          "type": "object",
          "additionalProperties": false,
          "required": ["reason", "sessionId", "observedAt"],
          "properties": {
            "reason": {
              "description": "Classified, whitelisted category only. null = no stop recorded for this session.",
              "enum": ["userRequested", "protectionTriggered", "abnormalExit", "unknown", null]
            },
            "sessionId": {
              "type": ["string", "null"],
              "minLength": 1,
              "maxLength": 128
            },
            "observedAt": { "$ref": "#/$defs/timestampOrNull" }
          }
        },
        "earnings": {
          "description": "OPTIONAL extension sent with feed.market (see there). Null when this machine has no pool estimate.",
          "oneOf": [{ "type": "null" }, { "$ref": "#/$defs/earnings" }]
        },
        "assessment": {
          "description": "OPTIONAL extension (feature `assessment`): the publisher's own judgment, shown by the app while this sample is fresh. Null when the publisher has no judgment.",
          "oneOf": [{ "type": "null" }, { "$ref": "#/$defs/assessment" }]
        },
        "health": {
          "description": "OPTIONAL extension (feature `assessment`): supporting details for the judgment.",
          "oneOf": [{ "type": "null" }, { "$ref": "#/$defs/health" }]
        },
        "control": {
          "description": "OPTIONAL extension (feature `control`): present only for machines the source lets the app start and stop (POST /control/<machineId>/<start|stop> with a token the user enters). Which buttons fit the reported miner state.",
          "oneOf": [{ "type": "null" }, { "$ref": "#/$defs/control" }]
        }
      }
    },
    "control": {
      "type": "object",
      "additionalProperties": false,
      "required": ["canStart", "canStop"],
      "properties": {
        "canStart": { "type": "boolean" },
        "canStop": { "type": "boolean" }
      }
    },
    "market": {
      "description": "Prices for converting estimated earnings. All USD prices; usdTwd is TWD per USD.",
      "type": "object",
      "additionalProperties": false,
      "required": ["coin", "coinUsd", "btcUsd", "usdTwd", "observedAt"],
      "properties": {
        "coin": { "type": "string", "pattern": "^[A-Z0-9]{2,10}$" },
        "coinUsd": { "type": ["number", "null"], "minimum": 0 },
        "btcUsd": { "type": ["number", "null"], "exclusiveMinimum": 0 },
        "usdTwd": { "type": ["number", "null"], "exclusiveMinimum": 0 },
        "observedAt": { "$ref": "#/$defs/timestampOrNull" }
      }
    },
    "cumulative": {
      "description": "Running estimate since `since`; each machine in its own coin, and in TWD at the price when it was earned.",
      "type": "object",
      "additionalProperties": false,
      "required": ["since", "observedAt", "totalTwd", "machines"],
      "properties": {
        "since": { "$ref": "#/$defs/timestamp" },
        "observedAt": { "$ref": "#/$defs/timestampOrNull" },
        "totalTwd": { "type": "number", "minimum": 0 },
        "machines": {
          "type": "array",
          "maxItems": 8,
          "items": {
            "type": "object",
            "additionalProperties": false,
            "required": ["machineId", "coin", "amount", "twd"],
            "properties": {
              "machineId": { "type": "string", "minLength": 1, "pattern": "^[A-Za-z0-9._-]+$" },
              "coin": { "type": "string", "pattern": "^[A-Z0-9]{2,10}$" },
              "amount": { "type": "number", "minimum": 0 },
              "twd": { "type": "number", "minimum": 0 }
            }
          }
        }
      }
    },
    "tariff": {
      "type": "object",
      "additionalProperties": false,
      "required": ["name", "effectiveDate", "summerPeak", "summerOffPeak", "nonSummerPeak", "nonSummerOffPeak",
                   "periodsMatch", "offPeakDates", "observedAt"],
      "properties": {
        "name": { "type": "string", "minLength": 1, "maxLength": 40 },
        "effectiveDate": { "type": ["string", "null"], "pattern": "^\\d{4}-\\d{2}-\\d{2}$" },
        "summerPeak": { "type": "number", "minimum": 0 },
        "summerOffPeak": { "type": "number", "minimum": 0 },
        "nonSummerPeak": { "type": "number", "minimum": 0 },
        "nonSummerOffPeak": { "type": "number", "minimum": 0 },
        "periodsMatch": { "description": "False when the published time windows differ from the ones the app implements.", "type": ["boolean", "null"] },
        "offPeakDates": {
          "type": "array", "maxItems": 60,
          "items": { "type": "string", "pattern": "^\\d{4}-\\d{2}-\\d{2}$" }
        },
        "observedAt": { "$ref": "#/$defs/timestampOrNull" }
      }
    },
    "advice": {
      "description": "Publisher's mine-or-rest recommendation for one billed machine, from its measured hashrate and power, the pool estimate and the tariff. monthlyNetTwd is the estimated NT$ a month after electricity; the recommendation turns to mine at startAtTwd and to rest below stopBelowTwd, each held for some hours.",
      "type": "object",
      "additionalProperties": false,
      "required": ["machineId", "displayName", "recommendation", "monthlyNetTwd", "startAtTwd", "stopBelowTwd",
                   "reason", "since", "observedAt"],
      "properties": {
        "machineId": { "type": "string", "pattern": "^[A-Za-z0-9._-]+$" },
        "displayName": { "type": "string", "minLength": 1, "maxLength": 40 },
        "recommendation": { "enum": ["mine", "rest"] },
        "monthlyNetTwd": { "type": ["number", "null"] },
        "startAtTwd": { "type": "number" },
        "stopBelowTwd": { "type": "number" },
        "reason": { "type": "string", "minLength": 1, "maxLength": 200 },
        "since": { "description": "When the recommendation last changed; null before the first change.", "$ref": "#/$defs/timestampOrNull" },
        "observedAt": { "$ref": "#/$defs/timestampOrNull" },
        "canWake": { "description": "OPTIONAL, sent only with feature `wake`: true when the machine is switched off and the source can power it on (POST /control/<machineId>/wake).", "type": "boolean" }
      }
    },
    "earnings": {
      "description": "Pool-side estimate for one machine: coin per day at the pool's recent average hashrate, after the pool fee. An estimate, not the credited amount.",
      "type": "object",
      "additionalProperties": false,
      "required": ["coinPerDay", "poolHashrate", "electricityBilled", "observedAt"],
      "properties": {
        "coinPerDay": { "type": ["number", "null"], "minimum": 0 },
        "poolHashrate": { "description": "H/s, the pool's recent average for this worker.", "type": ["number", "null"], "minimum": 0 },
        "electricityBilled": { "description": "Publisher's default for whether this machine's electricity costs money; the app lets the user override it.", "type": ["boolean", "null"] },
        "observedAt": { "$ref": "#/$defs/timestampOrNull" },
        "coin": { "description": "OPTIONAL, sent only with feature `coins`, and only for a machine mining another coin than `market` (an FPGA on QTC). The app prices that machine with coinUsd instead of the market coin.", "type": "string", "pattern": "^[A-Z0-9]{2,10}$" },
        "coinUsd": { "description": "OPTIONAL, with `coin`: that coin's USD price; null when unknown.", "type": ["number", "null"], "minimum": 0 }
      }
    },
    "assessment": {
      "description": "Light, short title and plain-language reason decided by the publisher.",
      "type": "object",
      "additionalProperties": false,
      "required": ["light", "title", "reason", "observedAt"],
      "properties": {
        "light": { "enum": ["green", "yellow", "red", "gray"] },
        "title": { "type": "string", "minLength": 1, "maxLength": 40 },
        "reason": { "type": "string", "minLength": 1, "maxLength": 200 },
        "observedAt": { "$ref": "#/$defs/timestampOrNull" }
      }
    },
    "health": {
      "type": "object",
      "additionalProperties": false,
      "required": ["uptimeSeconds", "lastShareAt", "expectedShareSeconds", "poolHashrate", "poolOnline",
                   "validSharePercent", "maxGpuTemperatureC", "temperatureLimitC", "observedAt"],
      "properties": {
        "uptimeSeconds": { "type": ["number", "null"], "minimum": 0 },
        "lastShareAt": { "$ref": "#/$defs/timestampOrNull" },
        "expectedShareSeconds": { "description": "Usual time between accepted shares.", "type": ["number", "null"], "exclusiveMinimum": 0 },
        "poolHashrate": { "description": "H/s, the pool's recent (30 min) average for this worker.", "type": ["number", "null"], "minimum": 0 },
        "poolOnline": { "type": ["boolean", "null"] },
        "validSharePercent": { "type": ["number", "null"], "minimum": 0, "maximum": 100 },
        "maxGpuTemperatureC": { "type": ["number", "null"], "minimum": -40, "maximum": 150 },
        "temperatureLimitC": { "description": "The miner's own protective cutoff, if known.", "type": ["number", "null"], "minimum": 0, "maximum": 150 },
        "observedAt": { "$ref": "#/$defs/timestampOrNull" }
      }
    },
    "gpu": {
      "type": "object",
      "additionalProperties": false,
      "required": ["index", "temperatureC", "fanPercent", "powerW", "observedAt"],
      "properties": {
        "index": {
          "type": "integer",
          "minimum": 0
        },
        "temperatureC": {
          "type": ["number", "null"],
          "minimum": -40,
          "maximum": 150
        },
        "fanPercent": {
          "type": ["number", "null"],
          "minimum": 0,
          "maximum": 100
        },
        "powerW": {
          "type": ["number", "null"],
          "minimum": 0
        },
        "observedAt": { "$ref": "#/$defs/timestampOrNull" }
      }
    }
  }
}
